{
 "schema_version": "1.0",
 "systems": [
  {
   "id": "setup0",
   "label": "SharePoint",
   "config_label": "SharePoint itself, read as the persona; no search layer"
  },
  {
   "id": "setup_a_basic",
   "label": "Azure AI Search",
   "config_label": "Azure AI Search SharePoint indexer, basic ACL configuration (users and Entra groups, no SharePoint-group support), 5-min schedule, ACL-filtered index"
  },
  {
   "id": "setup_b",
   "label": "Revocation layer",
   "config_label": "Setup B: our API over a separate, unfiltered index of the same SharePoint data source; access decided from live membership and ACL state (polled every 5 s)"
  }
 ],
 "config": {
  "read_interval_s": 5.0,
  "poll_cap_s": 3600.0,
  "n_consecutive": 10.0
 },
 "cells": [
  {
   "scenario": "S1-direct",
   "system": "setup0",
   "planned": 1,
   "replicates": 1,
   "first_deny": {
    "n": 1,
    "min": 18.034,
    "median": 18.034,
    "max": 18.034
   },
   "leak_exposure": {
    "n": 1,
    "min": 0.0,
    "median": 0.0,
    "max": 0.0
   },
   "did_not_converge": 0,
   "nothing_to_revoke": 0
  },
  {
   "scenario": "S1-direct",
   "system": "setup_a_basic",
   "planned": 1,
   "replicates": 1,
   "first_deny": {
    "n": 1,
    "min": 298.198,
    "median": 298.198,
    "max": 298.198
   },
   "leak_exposure": {
    "n": 1,
    "min": 293.259,
    "median": 293.259,
    "max": 293.259
   },
   "did_not_converge": 0,
   "nothing_to_revoke": 0
  },
  {
   "scenario": "S1-direct",
   "system": "setup_b",
   "planned": 1,
   "replicates": 1,
   "first_deny": {
    "n": 1,
    "min": 18.227,
    "median": 18.227,
    "max": 18.227
   },
   "leak_exposure": {
    "n": 1,
    "min": 0.0,
    "median": 0.0,
    "max": 0.0
   },
   "did_not_converge": 0,
   "nothing_to_revoke": 0
  },
  {
   "scenario": "S1-spgroup",
   "system": "setup0",
   "planned": 1,
   "replicates": 1,
   "first_deny": {
    "n": 1,
    "min": 6.358,
    "median": 6.358,
    "max": 6.358
   },
   "leak_exposure": {
    "n": 1,
    "min": 0.0,
    "median": 0.0,
    "max": 0.0
   },
   "did_not_converge": 0,
   "nothing_to_revoke": 0
  },
  {
   "scenario": "S1-spgroup",
   "system": "setup_a_basic",
   "planned": 1,
   "replicates": 1,
   "first_deny": {
    "n": 0,
    "min": null,
    "median": null,
    "max": null
   },
   "leak_exposure": {
    "n": 0,
    "min": null,
    "median": null,
    "max": null
   },
   "did_not_converge": 0,
   "nothing_to_revoke": 1
  },
  {
   "scenario": "S1-spgroup",
   "system": "setup_b",
   "planned": 1,
   "replicates": 1,
   "first_deny": {
    "n": 1,
    "min": 9.828,
    "median": 9.828,
    "max": 9.828
   },
   "leak_exposure": {
    "n": 1,
    "min": 6.374,
    "median": 6.374,
    "max": 6.374
   },
   "did_not_converge": 0,
   "nothing_to_revoke": 0
  },
  {
   "scenario": "S1-entra",
   "system": "setup0",
   "planned": 7,
   "replicates": 1,
   "first_deny": {
    "n": 1,
    "min": 2743.423,
    "median": 2743.423,
    "max": 2743.423
   },
   "leak_exposure": {
    "n": 1,
    "min": 3290.902,
    "median": 3290.902,
    "max": 3290.902
   },
   "did_not_converge": 0,
   "nothing_to_revoke": 0
  },
  {
   "scenario": "S1-entra",
   "system": "setup_a_basic",
   "planned": 7,
   "replicates": 1,
   "first_deny": {
    "n": 1,
    "min": 93.269,
    "median": 93.269,
    "max": 93.269
   },
   "leak_exposure": {
    "n": 1,
    "min": 87.097,
    "median": 87.097,
    "max": 87.097
   },
   "did_not_converge": 0,
   "nothing_to_revoke": 0
  },
  {
   "scenario": "S1-entra",
   "system": "setup_b",
   "planned": 7,
   "replicates": 1,
   "first_deny": {
    "n": 1,
    "min": 10.332,
    "median": 10.332,
    "max": 10.332
   },
   "leak_exposure": {
    "n": 1,
    "min": 0.0,
    "median": 0.0,
    "max": 0.0
   },
   "did_not_converge": 0,
   "nothing_to_revoke": 0
  },
  {
   "scenario": "S2-nested-group-removal",
   "system": "setup0",
   "planned": 7,
   "replicates": 1,
   "first_deny": {
    "n": 1,
    "min": 2953.855,
    "median": 2953.855,
    "max": 2953.855
   },
   "leak_exposure": {
    "n": 1,
    "min": 3460.332,
    "median": 3460.332,
    "max": 3460.332
   },
   "did_not_converge": 0,
   "nothing_to_revoke": 0
  },
  {
   "scenario": "S2-nested-group-removal",
   "system": "setup_a_basic",
   "planned": 7,
   "replicates": 1,
   "first_deny": {
    "n": 1,
    "min": 206.833,
    "median": 206.833,
    "max": 206.833
   },
   "leak_exposure": {
    "n": 1,
    "min": 202.376,
    "median": 202.376,
    "max": 202.376
   },
   "did_not_converge": 0,
   "nothing_to_revoke": 0
  },
  {
   "scenario": "S2-nested-group-removal",
   "system": "setup_b",
   "planned": 7,
   "replicates": 1,
   "first_deny": {
    "n": 1,
    "min": 15.887,
    "median": 15.887,
    "max": 15.887
   },
   "leak_exposure": {
    "n": 1,
    "min": 8.827,
    "median": 8.827,
    "max": 8.827
   },
   "did_not_converge": 0,
   "nothing_to_revoke": 0
  },
  {
   "scenario": "S4-move-into-restricted",
   "system": "setup0",
   "planned": 1,
   "replicates": 1,
   "first_deny": {
    "n": 0,
    "min": null,
    "median": null,
    "max": null
   },
   "leak_exposure": {
    "n": 0,
    "min": null,
    "median": null,
    "max": null
   },
   "did_not_converge": 0,
   "nothing_to_revoke": 0
  },
  {
   "scenario": "S4-move-into-restricted",
   "system": "setup_a_basic",
   "planned": 1,
   "replicates": 1,
   "first_deny": {
    "n": 0,
    "min": null,
    "median": null,
    "max": null
   },
   "leak_exposure": {
    "n": 0,
    "min": null,
    "median": null,
    "max": null
   },
   "did_not_converge": 0,
   "nothing_to_revoke": 0
  },
  {
   "scenario": "S4-move-into-restricted",
   "system": "setup_b",
   "planned": 1,
   "replicates": 1,
   "first_deny": {
    "n": 0,
    "min": null,
    "median": null,
    "max": null
   },
   "leak_exposure": {
    "n": 0,
    "min": null,
    "median": null,
    "max": null
   },
   "did_not_converge": 0,
   "nothing_to_revoke": 0
  }
 ],
 "s6": {
  "naive": {
   "trials": 18,
   "leaks": 18,
   "invalid": 0,
   "leaks_via_cache_memory": 18,
   "leaks_via_retrieval": 0
  },
  "guarded": {
   "trials": 9,
   "leaks": 0,
   "invalid": 0,
   "leaks_via_cache_memory": 0,
   "leaks_via_retrieval": 0
  },
  "positive_control": {
   "trials": 9,
   "served": 9
  }
 },
 "totals": {
  "runs": 1,
  "replicates": 5,
  "reads": 16974,
  "documents": 45,
  "personas": 7
 },
 "caveats": [
  "Sample sizes: each scenario x system cell has between 1 and 1 complete replicates (planned: S1-direct 1, S1-spgroup 1, S1-entra 7, S2-nested-group-removal 7, S4-move-into-restricted 1). Minimum, median and maximum are descriptive; with so few replicates they are not estimates of a distribution, and no confidence interval or significance test is given. Cells below 3 replicates: S1-direct/setup0 (n=1), S1-direct/setup_a_basic (n=1), S1-direct/setup_b (n=1), S1-spgroup/setup0 (n=1), S1-spgroup/setup_a_basic (n=1), S1-spgroup/setup_b (n=1), S1-entra/setup0 (n=1), S1-entra/setup_a_basic (n=1), S1-entra/setup_b (n=1), S2-nested-group-removal/setup0 (n=1), S2-nested-group-removal/setup_a_basic (n=1), S2-nested-group-removal/setup_b (n=1), S4-move-into-restricted/setup0 (n=1), S4-move-into-restricted/setup_a_basic (n=1), S4-move-into-restricted/setup_b (n=1).",
  "System labels: 'setup0' reads SharePoint itself (no search layer) and is the reference. 'setup_a_basic' is Microsoft's SharePoint indexer with ACL ingestion in its plain configuration: users and Entra groups only, no SharePoint-group support, the smallest indexer schedule the service accepts (PT5M); it is not a tuned or best-case Setup A. Setup B queries a separate, unfiltered index over the same SharePoint data source; Setup A uses the ACL-filtered index.",
  "Scope: only the 7 persona accounts (p-ceo, p-finana, p-finlead, p-hr, p-intern, p-nest, p-plateng) are measured. The tenant admin holds full control and appears in every ACL; access held by the admin is out of scope.",
  "Single tenant: every run used the same tenant, SharePoint site and search service. Results may not transfer to other tenants, sizes or configurations; the corpus is small (45 documents).",
  "Dates: runs between 2026-10-18 11:46:27Z and 2026-10-18 12:51:06Z (UTC); this report was generated 2026-10-18 15:30:28Z. Replicates ran one after another, not interleaved, so time-of-day and service-side drift are not controlled.",
  "Method: read interval 5 s (every time below has that resolution); 'converged' means 10 conforming reads in a row; polling stopped 60 minutes after the change, so a DID_NOT_CONVERGE replicate is censored at the cap and its numbers are lower bounds. Every replicate started from a freshly generated tenant.",
  "Baseline: the baseline length alternates by run (1 min in runs [1, 3, 5, 7]; 10 min in runs [2, 4, 6]) for S1-entra. The other scenarios in a run share its baseline. The 'by baseline' rows separate the numbers.",
  "Data quality: 1 replicate(s) started from an unstable baseline for that system; 1 replicate(s) had nothing to revoke (the pair was not served before the change) and are excluded from first-deny and leak statistics; 36 planned replicate(s) have no result yet (not run, or the run stopped early).",
  "Setup B start-up: the runner waited for /ready before the baseline in 1 run(s); time to ready 76.628-76.628 s (median 76.628 s). Lockouts are counted only from reads after that point. The first sync was already complete in 1 of 1 run(s).",
  "Index cleanup: before 1 run(s) the documents of earlier tenant generations were deleted from both indexes (90 stale found, 90 deleted in total).",
  "Setup B is measured through its HTTP API with the persona's own token. Its index is refreshed by its own indexer on its own 5-minute cycle, so content freshness is comparable to Setup A's but not simultaneous. Post-filtering over a k*5 window loses results (273 recall samples, see the table)."
 ]
}
